{
  "cvss": [
    {
      "baseScore": 3.3,
      "baseSeverity": "LOW",
      "metric": "cvssV3_1",
      "source": "adp",
      "sourceIndex": 1,
      "vector": "CVSS:3.1/AV:L/AC:L/PR:L/UI:N/S:U/C:N/I:N/A:L",
      "version": "3.1"
    }
  ],
  "profile": {
    "attackPaths": [
      {
        "affectedScope": {
          "description": "GnuPG key processing and parsing routines",
          "vendor": "GnuPG",
          "versions": [
            {
              "status": "affected",
              "version": "gnupg2"
            }
          ]
        },
        "attackerRequirements": [
          {
            "kind": "input-control",
            "value": "untrusted-input"
          }
        ],
        "confidence": "high",
        "evidenceRefs": [
          "ev-1"
        ],
        "interactionInitiator": "user",
        "pathId": "path-1",
        "preconditions": [
          {
            "description": "GnuPG is instructed to parse or import a compressed public key carrying a large number of attached signatures.",
            "evidenceRefs": [
              "ev-1"
            ],
            "id": "precond-1",
            "kind": "state"
          }
        ],
        "protocols": [],
        "requiredPathCapabilities": [
          "local-input-transfer"
        ],
        "taxonomyMappings": [],
        "trigger": {
          "artifact": "file",
          "details": "GnuPG parses a crafted compressed public key file containing thousands of signatures, triggering excessive CPU consumption.",
          "directionAtBoundary": "local-to-vulnerable",
          "phase": "file-parsing"
        },
        "vulnerableRole": "parser"
      }
    ],
    "cveId": "CVE-2022-3219",
    "evidence": [
      {
        "claim": "GnuPG can be made to spin on a relatively small input by crafting a public key with thousands of signatures attached and compressed.",
        "evidenceId": "ev-1",
        "locator": "containers.cna.descriptions[0].value",
        "pathRefs": [
          "path-1"
        ],
        "sourceId": "cve-list-v5",
        "sourceType": "cve-record",
        "strength": "explicit"
      }
    ],
    "schemaVersion": "attack-path-profile/v1"
  },
  "provenance": {
    "modelVersion": "gemini-3.6-flash",
    "profileFingerprint": "30c7e65d8cdd0c87f6729c2a7827d06e0b86a714d4389f8bd56e3f437c7e107f",
    "sourceFingerprint": "bf8ce6f0563de56de062b4b5322b23eda17bd9db36735b4180db63cd6b516bde",
    "validatedAt": "2026-08-05T16:32:29Z"
  },
  "publication": {
    "artifactFingerprint": "c517e47b2cc9c22508796e974966a973a40e5fda956e2bb52d87818692e4d83b",
    "publishedAt": "2026-08-05T16:56:05Z",
    "runId": "352a56fa-ab92-4040-81ea-00e534351ad0",
    "status": "published"
  },
  "reviewReasons": [],
  "reviewRecommended": false,
  "schemaVersion": "published-attack-path-profile/v2"
}
