{
  "cvss": [
    {
      "baseScore": 7.5,
      "baseSeverity": "HIGH",
      "metric": "cvssV3_1",
      "source": "cna",
      "vector": "CVSS:3.1/AV:N/AC:L/PR:N/UI:N/S:U/C:N/I:N/A:H",
      "version": "3.1"
    }
  ],
  "profile": {
    "attackPaths": [
      {
        "affectedScope": {
          "description": "Mattermost Server binary WebSocket msgpack frame parser",
          "vendor": "Mattermost",
          "versions": [
            {
              "lessThanOrEqual": "11.6.0",
              "status": "affected",
              "version": "11.6.0",
              "versionType": "semver"
            },
            {
              "lessThanOrEqual": "11.5.3",
              "status": "affected",
              "version": "11.5.0",
              "versionType": "semver"
            },
            {
              "lessThanOrEqual": "11.4.4",
              "status": "affected",
              "version": "11.4.0",
              "versionType": "semver"
            },
            {
              "lessThanOrEqual": "10.11.14",
              "status": "affected",
              "version": "10.11.0",
              "versionType": "semver"
            },
            {
              "status": "unaffected",
              "version": "11.7.0"
            },
            {
              "status": "unaffected",
              "version": "11.6.1"
            },
            {
              "status": "unaffected",
              "version": "11.5.4"
            },
            {
              "status": "unaffected",
              "version": "11.4.5"
            },
            {
              "status": "unaffected",
              "version": "10.11.15"
            }
          ]
        },
        "attackerRequirements": [
          {
            "kind": "endpoint-control",
            "value": "remote-client"
          },
          {
            "kind": "input-control",
            "value": "untrusted-input"
          }
        ],
        "confidence": "high",
        "evidenceRefs": [
          "ev-1",
          "ev-2"
        ],
        "interactionInitiator": "attacker-controlled-component",
        "pathId": "path-1",
        "preconditions": [
          {
            "description": "The public WebSocket endpoint is active and accepts binary msgpack frames.",
            "evidenceRefs": [
              "ev-1"
            ],
            "id": "prec-1",
            "kind": "runtime-feature"
          }
        ],
        "protocols": [
          {
            "id": "websocket",
            "layer": "application"
          },
          {
            "id": "tcp",
            "layer": "transport"
          }
        ],
        "requiredPathCapabilities": [
          "remote-initiated-ingress"
        ],
        "taxonomyMappings": [
          {
            "confidence": "high",
            "evidenceRefs": [
              "ev-1",
              "ev-2"
            ],
            "relationship": "related-to",
            "taxonomyId": "CAPEC-130",
            "taxonomyName": "CAPEC",
            "taxonomyVersion": "3.9"
          }
        ],
        "trigger": {
          "artifact": "frame",
          "details": "Sending a crafted msgpack-encoded binary WebSocket message to the public WebSocket endpoint triggers unvalidated memory allocation, crashing the server process.",
          "directionAtBoundary": "remote-to-vulnerable",
          "phase": "protocol-message-processing"
        },
        "vulnerableRole": "listener"
      }
    ],
    "cveId": "CVE-2026-5740",
    "evidence": [
      {
        "claim": "Mattermost versions fail to properly validate msgpack-encoded WebSocket frames before memory allocation, allowing an unauthenticated remote attacker to crash the server process via a crafted binary WebSocket message sent to the public WebSocket endpoint.",
        "evidenceId": "ev-1",
        "locator": "/containers/cna/descriptions/0/value",
        "pathRefs": [
          "path-1"
        ],
        "sourceId": "cve-list-v5",
        "sourceType": "cve-record",
        "strength": "explicit"
      },
      {
        "claim": "Vulnerability is classified under CWE-789 Memory Allocation with Excessive Size Value.",
        "evidenceId": "ev-2",
        "locator": "/containers/cna/problemTypes/0/descriptions/0/cweId",
        "pathRefs": [
          "path-1"
        ],
        "sourceId": "cve-list-v5",
        "sourceType": "cve-record",
        "strength": "explicit"
      }
    ],
    "schemaVersion": "attack-path-profile/v1"
  },
  "provenance": {
    "modelVersion": "gemini-3.6-flash",
    "profileFingerprint": "4dc651cfdbdbec72b1ff85d53e6e8b569bf0ad7600d9e88f7de8f5c6bd838427",
    "sourceFingerprint": "1d83a42d05890440b85ea23ee070438dec6cf30c05a5b5c136089e10ca5202ef",
    "validatedAt": "2026-08-11T21:42:18Z"
  },
  "publication": {
    "artifactFingerprint": "76111f4b1544c97d34a242551249ea8e7765432b8bc182c98ba64d69649a28ad",
    "publishedAt": "2026-08-11T21:58:37Z",
    "runId": "efb9df21-cf0d-4849-b6ee-2b3d348af709",
    "status": "published"
  },
  "reviewReasons": [],
  "reviewRecommended": false,
  "schemaVersion": "published-attack-path-profile/v2"
}
