{
  "cvss": [
    {
      "baseScore": 8.8,
      "baseSeverity": "HIGH",
      "metric": "cvssV3_0",
      "source": "cna",
      "vector": "CVSS:3.0/AV:N/AC:L/PR:L/UI:N/S:U/C:H/I:H/A:H/E:P/RL:X/RC:R",
      "version": "3.0"
    },
    {
      "baseScore": 8.8,
      "baseSeverity": "HIGH",
      "metric": "cvssV3_1",
      "source": "cna",
      "vector": "CVSS:3.1/AV:N/AC:L/PR:L/UI:N/S:U/C:H/I:H/A:H/E:P/RL:X/RC:R",
      "version": "3.1"
    },
    {
      "baseScore": 8.7,
      "baseSeverity": "HIGH",
      "metric": "cvssV4_0",
      "source": "cna",
      "vector": "CVSS:4.0/AV:N/AC:L/AT:N/PR:L/UI:N/VC:H/VI:H/VA:H/SC:N/SI:N/SA:N/E:P",
      "version": "4.0"
    }
  ],
  "profile": {
    "attackPaths": [
      {
        "affectedScope": {
          "description": "Tenda W3 firmware version 1.0.0.3(2204) POST parameter handler for /goform/wifiSSIDset",
          "vendor": "Tenda",
          "versions": [
            {
              "status": "affected",
              "version": "1.0.0.3(2204)"
            }
          ]
        },
        "attackerRequirements": [
          {
            "kind": "endpoint-control",
            "value": "remote-client"
          },
          {
            "kind": "input-control",
            "value": "untrusted-input"
          }
        ],
        "confidence": "high",
        "evidenceRefs": [
          "ev-1"
        ],
        "interactionInitiator": "attacker-controlled-component",
        "notes": "A stack-based buffer overflow vulnerability in Tenda W3 POST parameter handler allows remote authenticated users to execute code or trigger buffer overflow via index or GO parameters in /goform/wifiSSIDset.",
        "pathId": "path-1",
        "preconditions": [
          {
            "description": "Authenticated session or low-privilege access to the web administrative interface.",
            "evidenceRefs": [
              "ev-1"
            ],
            "id": "precond-1",
            "kind": "authentication"
          }
        ],
        "protocols": [
          {
            "id": "http",
            "layer": "application"
          },
          {
            "id": "tcp",
            "layer": "transport"
          }
        ],
        "requiredPathCapabilities": [
          "remote-initiated-ingress"
        ],
        "taxonomyMappings": [
          {
            "confidence": "high",
            "evidenceRefs": [
              "ev-1"
            ],
            "relationship": "related-to",
            "taxonomyId": "CAPEC-100",
            "taxonomyName": "CAPEC",
            "taxonomyVersion": "3.9"
          }
        ],
        "trigger": {
          "artifact": "request",
          "details": "An HTTP POST request is sent to /goform/wifiSSIDset with a manipulated index or GO parameter value.",
          "directionAtBoundary": "remote-to-vulnerable",
          "phase": "inbound-request-processing"
        },
        "vulnerableRole": "listener"
      }
    ],
    "cveId": "CVE-2026-4008",
    "evidence": [
      {
        "claim": "Tenda W3 version 1.0.0.3(2204) POST parameter handler processes /goform/wifiSSIDset and is vulnerable to a stack-based buffer overflow via manipulation of the index/GO parameters by an authenticated remote attacker.",
        "evidenceId": "ev-1",
        "locator": "containers.cna.descriptions[0]",
        "pathRefs": [
          "path-1"
        ],
        "sourceId": "cve-list-v5",
        "sourceType": "cve-record",
        "strength": "explicit"
      }
    ],
    "schemaVersion": "attack-path-profile/v1"
  },
  "provenance": {
    "modelVersion": "gemini-3.6-flash",
    "profileFingerprint": "bc7c8397576774d237002fae5c8fb5bde933d0a595643fdc4e59d38305cfa9f1",
    "sourceFingerprint": "45d980bb216c98d4b9362af2f7eab36f59f36925f6f8e37309ac8321fa6a48d5",
    "validatedAt": "2026-08-11T21:42:18Z"
  },
  "publication": {
    "artifactFingerprint": "7a1b51b6444fdd5d2b9bf3819f98d4412f245a83043e98e80e05522a52dcef54",
    "publishedAt": "2026-08-11T21:58:23Z",
    "runId": "f4df425c-d001-4437-9d6e-206024ae2719",
    "status": "published"
  },
  "reviewReasons": [],
  "reviewRecommended": false,
  "schemaVersion": "published-attack-path-profile/v2"
}
