{
  "cvss": [
    {
      "baseScore": 8,
      "baseSeverity": "HIGH",
      "metric": "cvssV3_1",
      "source": "cna",
      "vector": "CVSS:3.1/AV:N/AC:H/PR:H/UI:N/S:C/C:H/I:H/A:H",
      "version": "3.1"
    }
  ],
  "profile": {
    "attackPaths": [
      {
        "affectedScope": {
          "description": "WPify Woo plugin for WordPress up to and including version 5.4.16",
          "vendor": "wpify",
          "versions": [
            {
              "lessThanOrEqual": "5.4.16",
              "status": "affected",
              "version": "0",
              "versionType": "semver"
            }
          ]
        },
        "attackerRequirements": [
          {
            "kind": "endpoint-control",
            "value": "remote-client"
          },
          {
            "kind": "input-control",
            "value": "untrusted-input"
          }
        ],
        "confidence": "high",
        "evidenceRefs": [
          "ev-1"
        ],
        "interactionInitiator": "attacker-controlled-component",
        "pathId": "path-1",
        "preconditions": [
          {
            "description": "Attacker must possess an authenticated WordPress account with manage_woocommerce capability or higher.",
            "evidenceRefs": [
              "ev-1"
            ],
            "id": "auth-manage-woocommerce",
            "kind": "authentication"
          },
          {
            "description": "WPify Woo REST route /wp-json/wpify-woo/v1/option is registered and enabled.",
            "evidenceRefs": [
              "ev-1"
            ],
            "id": "rest-route-active",
            "kind": "runtime-feature"
          }
        ],
        "protocols": [
          {
            "id": "http",
            "layer": "application"
          }
        ],
        "requiredPathCapabilities": [
          "remote-initiated-ingress"
        ],
        "taxonomyMappings": [],
        "trigger": {
          "artifact": "request",
          "details": "Authenticated POST request to /wp-json/wpify-woo/v1/option with option and data parameters is passed directly to update_option without parameter allowlisting.",
          "directionAtBoundary": "remote-to-vulnerable",
          "phase": "inbound-request-processing"
        },
        "vulnerableRole": "listener"
      }
    ],
    "cveId": "CVE-2026-12736",
    "evidence": [
      {
        "claim": "WPify Woo plugin for WordPress <= 5.4.16 allows authenticated attackers with manage_woocommerce privilege to execute arbitrary option updates via POST /wp-json/wpify-woo/v1/option and elevate privileges to administrator.",
        "evidenceId": "ev-1",
        "locator": "containers.cna.descriptions[0].value",
        "pathRefs": [
          "path-1"
        ],
        "sourceId": "cve-list-v5",
        "sourceType": "cve-record",
        "strength": "explicit"
      }
    ],
    "schemaVersion": "attack-path-profile/v1"
  },
  "provenance": {
    "modelVersion": "gemini-3.6-flash",
    "profileFingerprint": "39e3594f0f54ce388ddeee779ba767776e7f9cd0c4085181705f61a0e4ab43dd",
    "sourceFingerprint": "434fa86f704e2c43580f321c4cae098bcdd7c70a2e5040b041379fa8ba70d11c",
    "validatedAt": "2026-08-13T01:00:14Z"
  },
  "publication": {
    "artifactFingerprint": "737b00e9737d99202a56e42dad281390e08e025963412571b22fc489c12f114d",
    "publishedAt": "2026-08-13T01:24:50Z",
    "runId": "fe70585b-59f7-419c-a236-74e95feceff7",
    "status": "published"
  },
  "reviewReasons": [],
  "reviewRecommended": false,
  "schemaVersion": "published-attack-path-profile/v2"
}
