{
  "cvss": [],
  "profile": {
    "attackPaths": [
      {
        "affectedScope": {
          "description": "Linux kernel PCI controller driver for i.MX6 (pci-imx6.c) on i.MX6QDL platform",
          "vendor": "Linux",
          "versions": [
            {
              "lessThan": "6.12.4",
              "status": "affected",
              "version": "4.20",
              "versionType": "semver"
            },
            {
              "lessThan": "6.13",
              "status": "affected",
              "version": "4.20",
              "versionType": "semver"
            }
          ]
        },
        "attackerRequirements": [
          {
            "kind": "local-access",
            "value": "local-process"
          }
        ],
        "confidence": "high",
        "evidenceRefs": [
          "ev-cve-record",
          "ev-cve-versions"
        ],
        "interactionInitiator": "system",
        "notes": "System power management transitions cause a kernel crash or hang due to invalid power state transitions and unhandled external aborts on i.MX6QDL platforms.",
        "pathId": "path-1",
        "preconditions": [
          {
            "description": "Linux kernel version is 4.20 or later and prior to 6.12.4 / 6.13.",
            "evidenceRefs": [
              "ev-cve-versions"
            ],
            "id": "pre-1",
            "kind": "version"
          },
          {
            "description": "System runs on i.MX6QDL hardware with an active PCIe device connected.",
            "evidenceRefs": [
              "ev-cve-record"
            ],
            "id": "pre-2",
            "kind": "runtime-feature"
          }
        ],
        "protocols": [],
        "requiredPathCapabilities": [
          "local-input-transfer"
        ],
        "taxonomyMappings": [],
        "trigger": {
          "artifact": "none",
          "details": "The kernel PCI controller driver executes power management suspend/resume routines on i.MX6QDL hardware with an attached PCIe device.",
          "directionAtBoundary": "none",
          "phase": "scheduled-processing"
        },
        "vulnerableRole": "local-component"
      }
    ],
    "cveId": "CVE-2024-57809",
    "evidence": [
      {
        "claim": "PCI suspend/resume functionality on i.MX6QDL platforms with connected PCIe devices triggers imprecise external abort faults and kernel hangs.",
        "evidenceId": "ev-cve-record",
        "locator": "containers.cna.descriptions[0].value",
        "pathRefs": [
          "path-1"
        ],
        "sourceId": "cve-list-v5",
        "sourceType": "cve-record",
        "strength": "explicit"
      },
      {
        "claim": "The vulnerability affects Linux kernel versions 4.20 up to fixes in 6.12.4 and 6.13.",
        "evidenceId": "ev-cve-versions",
        "locator": "containers.cna.affected[1].versions",
        "pathRefs": [
          "path-1"
        ],
        "sourceId": "cve-list-v5",
        "sourceType": "cve-record",
        "strength": "explicit"
      }
    ],
    "schemaVersion": "attack-path-profile/v1"
  },
  "provenance": {
    "modelVersion": "gemini-3.6-flash",
    "profileFingerprint": "75d731ef2c026e06031b414df5d63cf02b953ca563e73f7af4cfe1071132d7fe",
    "sourceFingerprint": "a1730f640cb92a9840d9b9afb81d1a3f4d30dae972edc11065189b2118494b70",
    "validatedAt": "2026-08-05T16:32:25Z"
  },
  "publication": {
    "artifactFingerprint": "2ec65c1073fffdbc811d905a24d4e755d5aa5fa27a8b0c484c557596f81c4496",
    "publishedAt": "2026-08-05T16:56:16Z",
    "runId": "352a56fa-ab92-4040-81ea-00e534351ad0",
    "status": "published"
  },
  "reviewReasons": [],
  "reviewRecommended": false,
  "schemaVersion": "published-attack-path-profile/v2"
}
