{
  "cvss": [
    {
      "baseScore": 4.7,
      "baseSeverity": "MEDIUM",
      "metric": "cvssV3_1",
      "source": "cna",
      "vector": "CVSS:3.1/AV:L/AC:H/PR:L/UI:N/S:U/C:H/I:N/A:N",
      "version": "3.1"
    }
  ],
  "profile": {
    "attackPaths": [
      {
        "affectedScope": {
          "description": "HashiCorp consul-template before version 0.42.1",
          "vendor": "HashiCorp",
          "versions": [
            {
              "lessThan": "0.42.1",
              "status": "affected",
              "version": "0.1.0",
              "versionType": "semver"
            }
          ]
        },
        "attackerRequirements": [
          {
            "kind": "local-access",
            "value": "local-user"
          },
          {
            "kind": "input-control",
            "value": "untrusted-input"
          }
        ],
        "confidence": "high",
        "evidenceRefs": [
          "ev-cve",
          "ev-capec",
          "ev-cwe"
        ],
        "interactionInitiator": "local-process",
        "pathId": "path-0",
        "preconditions": [
          {
            "description": "The template uses the writeToFile helper function to write output to disk.",
            "evidenceRefs": [
              "ev-cve"
            ],
            "id": "cond-writetofile-helper",
            "kind": "api-usage"
          },
          {
            "description": "consul-template version is prior to 0.42.1.",
            "evidenceRefs": [
              "ev-cve"
            ],
            "id": "cond-vulnerable-version",
            "kind": "version"
          }
        ],
        "protocols": [],
        "requiredPathCapabilities": [
          "local-input-transfer"
        ],
        "taxonomyMappings": [
          {
            "confidence": "high",
            "evidenceRefs": [
              "ev-capec"
            ],
            "relationship": "instance-of",
            "taxonomyId": "CAPEC-132",
            "taxonomyName": "CAPEC",
            "taxonomyVersion": "3.9"
          }
        ],
        "trigger": {
          "artifact": "api-arguments",
          "details": "Execution of the writeToFile template helper follows arbitrary target links or redirected paths.",
          "directionAtBoundary": "local-to-vulnerable",
          "phase": "local-invocation"
        },
        "vulnerableRole": "local-component"
      }
    ],
    "cveId": "CVE-2026-14361",
    "evidence": [
      {
        "claim": "The consul-template library before 0.42.1 is vulnerable to path redirection in the writeToFile helper allowing output outside intended directories or file overwrites.",
        "evidenceId": "ev-cve",
        "locator": "containers.cna.descriptions[0].value",
        "pathRefs": [
          "path-0"
        ],
        "sourceId": "cve-list-v5",
        "sourceType": "cve-record",
        "strength": "explicit"
      },
      {
        "claim": "The CNA classifies the writeToFile path redirection as a symlink attack under CAPEC-132.",
        "evidenceId": "ev-capec",
        "locator": "containers.cna.impacts[0]",
        "pathRefs": [
          "path-0"
        ],
        "sourceId": "cve-list-v5",
        "sourceType": "cve-record",
        "strength": "explicit"
      },
      {
        "claim": "The vulnerability is assigned CWE-59 for improper link resolution before file access.",
        "evidenceId": "ev-cwe",
        "locator": "containers.cna.problemTypes[0].descriptions[0]",
        "pathRefs": [
          "path-0"
        ],
        "sourceId": "cve-list-v5",
        "sourceType": "cve-record",
        "strength": "explicit"
      }
    ],
    "schemaVersion": "attack-path-profile/v1"
  },
  "provenance": {
    "modelVersion": "gemini-3.6-flash",
    "profileFingerprint": "9ff281b097e0ee859764aea9eb6b9816e6a24c420f8123353377134f8c540ec1",
    "sourceFingerprint": "4923fe3038dd011d2bf003fc34f027cff8ed2dfb80153f47e50e3c634a4efb49",
    "validatedAt": "2026-08-12T23:47:01Z"
  },
  "publication": {
    "artifactFingerprint": "789e18840ff752bd814f187fac0f71256575cd696f4b27d16da1070556bb28c5",
    "publishedAt": "2026-08-13T00:14:34Z",
    "runId": "ed9929f1-c3a8-4368-8c21-82808c2b697b",
    "status": "published"
  },
  "reviewReasons": [],
  "reviewRecommended": false,
  "schemaVersion": "published-attack-path-profile/v2"
}
