{
  "cvss": [
    {
      "baseScore": 4.3,
      "baseSeverity": "MEDIUM",
      "metric": "cvssV3_0",
      "source": "cna",
      "vector": "CVSS:3.0/AV:N/AC:L/PR:N/UI:R/S:U/C:N/I:L/A:N/E:P/RL:X/RC:R",
      "version": "3.0"
    },
    {
      "baseScore": 4.3,
      "baseSeverity": "MEDIUM",
      "metric": "cvssV3_1",
      "source": "cna",
      "vector": "CVSS:3.1/AV:N/AC:L/PR:N/UI:R/S:U/C:N/I:L/A:N/E:P/RL:X/RC:R",
      "version": "3.1"
    },
    {
      "baseScore": 5.3,
      "baseSeverity": "MEDIUM",
      "metric": "cvssV4_0",
      "source": "cna",
      "vector": "CVSS:4.0/AV:N/AC:L/AT:N/PR:N/UI:P/VC:N/VI:L/VA:N/SC:N/SI:N/SA:N/E:P",
      "version": "4.0"
    }
  ],
  "profile": {
    "attackPaths": [
      {
        "affectedScope": {
          "description": "SourceCodester Class and Exam Timetabling System 1.0 /BSIS.php script",
          "vendor": "SourceCodester",
          "versions": [
            {
              "status": "affected",
              "version": "1.0"
            }
          ]
        },
        "attackerRequirements": [
          {
            "kind": "endpoint-control",
            "value": "remote-client"
          },
          {
            "kind": "input-control",
            "value": "untrusted-input"
          }
        ],
        "confidence": "high",
        "evidenceRefs": [
          "ev-xss-desc",
          "ev-cvss-ui"
        ],
        "interactionInitiator": "attacker-controlled-component",
        "pathId": "path-1",
        "preconditions": [
          {
            "description": "A user must open a crafted link or submit a request containing the manipulated day parameter.",
            "evidenceRefs": [
              "ev-cvss-ui"
            ],
            "id": "precond-user-interaction",
            "kind": "user-action"
          }
        ],
        "protocols": [
          {
            "id": "http",
            "layer": "application"
          },
          {
            "id": "tcp",
            "layer": "transport"
          }
        ],
        "requiredPathCapabilities": [
          "remote-initiated-ingress"
        ],
        "taxonomyMappings": [],
        "trigger": {
          "artifact": "request",
          "details": "An HTTP request processing the unescaped day parameter in /BSIS.php.",
          "directionAtBoundary": "remote-to-vulnerable",
          "phase": "inbound-request-processing"
        },
        "vulnerableRole": "listener"
      }
    ],
    "cveId": "CVE-2026-16486",
    "evidence": [
      {
        "claim": "SourceCodester Class and Exam Timetabling System 1.0 /BSIS.php is vulnerable to cross-site scripting via manipulation of the day argument.",
        "evidenceId": "ev-xss-desc",
        "locator": "/containers/cna/descriptions/0/value",
        "pathRefs": [
          "path-1"
        ],
        "sourceId": "cve-list-v5",
        "sourceType": "cve-record",
        "strength": "explicit"
      },
      {
        "claim": "Exploitation requires user interaction as indicated by CVSS metrics UI:P and UI:R.",
        "evidenceId": "ev-cvss-ui",
        "locator": "/containers/cna/metrics/0/cvssV4_0/vectorString",
        "pathRefs": [
          "path-1"
        ],
        "sourceId": "cve-list-v5",
        "sourceType": "cve-record",
        "strength": "explicit"
      }
    ],
    "schemaVersion": "attack-path-profile/v1"
  },
  "provenance": {
    "modelVersion": "gemini-3.6-flash",
    "profileFingerprint": "91e80944749318a80f72d85eecf0d4951c9660eaebc6fdba1b27bc881b81b9e4",
    "sourceFingerprint": "4ec302854e0166da4ea7eafa90000d41630a434f87888f222974112f48811d74",
    "validatedAt": "2026-08-12T23:46:57Z"
  },
  "publication": {
    "artifactFingerprint": "da98dc11ff9a7f42e50a094c234d2c433089d97d08ffdb45ef0de99739a1c815",
    "publishedAt": "2026-08-13T00:15:12Z",
    "runId": "5064099d-db1d-4e0a-a01c-fb48da74f05a",
    "status": "published"
  },
  "reviewReasons": [],
  "reviewRecommended": false,
  "schemaVersion": "published-attack-path-profile/v2"
}
