{
  "cvss": [],
  "profile": {
    "attackPaths": [
      {
        "affectedScope": {
          "description": "SQLite 3.30.1 sqlite3Select routine in select.c",
          "vendor": "SQLite",
          "versions": [
            {
              "status": "affected",
              "version": "3.30.1"
            }
          ]
        },
        "attackerRequirements": [
          {
            "kind": "input-control",
            "value": "untrusted-input"
          }
        ],
        "confidence": "high",
        "evidenceRefs": [
          "ev-cve-desc"
        ],
        "interactionInitiator": "local-process",
        "pathId": "path-sqlite3select-dos",
        "preconditions": [
          {
            "description": "An application passes a SQL query containing a sub-select with DISTINCT, window functions, and an ORDER BY clause to the vulnerable SQLite library routine.",
            "evidenceRefs": [
              "ev-cve-desc"
            ],
            "id": "precond-subselect-query-structure",
            "kind": "api-usage"
          }
        ],
        "protocols": [],
        "requiredPathCapabilities": [
          "local-input-transfer"
        ],
        "taxonomyMappings": [],
        "trigger": {
          "artifact": "api-arguments",
          "details": "Execution of a sub-select query containing both DISTINCT and window functions with specific ORDER BY clauses triggers a crash in sqlite3Select.",
          "directionAtBoundary": "local-to-vulnerable",
          "phase": "local-invocation"
        },
        "vulnerableRole": "local-component"
      }
    ],
    "cveId": "CVE-2019-19244",
    "evidence": [
      {
        "claim": "sqlite3Select in select.c in SQLite 3.30.1 allows a crash if a sub-select uses both DISTINCT and window functions, and also has certain ORDER BY usage.",
        "evidenceId": "ev-cve-desc",
        "locator": "containers.cna.descriptions[0].value",
        "pathRefs": [
          "path-sqlite3select-dos"
        ],
        "sourceId": "cve-list-v5",
        "sourceType": "cve-record",
        "strength": "explicit"
      }
    ],
    "schemaVersion": "attack-path-profile/v1"
  },
  "provenance": {
    "modelVersion": "gemini-3.6-flash",
    "profileFingerprint": "09bc78f7d7e1e110b89a17b289832d83f5f6eeec1d3deef70751b67968c66c62",
    "sourceFingerprint": "ca31e57a4c559be1ca2e121f9fe5f9e7120bfd2956bf2d20914e53b6c68ff76c",
    "validatedAt": "2026-08-07T04:09:23Z"
  },
  "publication": {
    "artifactFingerprint": "964b1e8224cf02c9f42f417a223541fadcd530a34eba09c07d02b8e981d52aa8",
    "publishedAt": "2026-08-07T04:35:27Z",
    "runId": "fe69ab33-9cca-41e0-9103-8d3b4d2b1da1",
    "status": "published"
  },
  "reviewReasons": [],
  "reviewRecommended": false,
  "schemaVersion": "published-attack-path-profile/v2"
}
