{
  "cvss": [
    {
      "baseScore": 7.5,
      "baseSeverity": "HIGH",
      "metric": "cvssV3_1",
      "source": "adp",
      "sourceIndex": 0,
      "vector": "CVSS:3.1/AV:N/AC:H/PR:L/UI:N/S:U/C:H/I:H/A:H",
      "version": "3.1"
    }
  ],
  "profile": {
    "attackPaths": [
      {
        "affectedScope": {
          "description": "Customer Switching plugin for WordPress prior to version 2.1.3",
          "product": "Customer Switching",
          "vendor": "Unknown",
          "versions": [
            {
              "lessThan": "2.1.3",
              "status": "affected",
              "version": "0",
              "versionType": "semver"
            }
          ]
        },
        "attackerRequirements": [
          {
            "kind": "endpoint-control",
            "value": "remote-client"
          },
          {
            "kind": "input-control",
            "value": "untrusted-input"
          }
        ],
        "confidence": "high",
        "evidenceRefs": [
          "ev-1"
        ],
        "interactionInitiator": "attacker-controlled-component",
        "pathId": "path-1",
        "preconditions": [
          {
            "description": "An operator must be currently switched into the lower-privileged user account.",
            "evidenceRefs": [
              "ev-1"
            ],
            "id": "active-user-switching-session",
            "kind": "state"
          },
          {
            "description": "Attacker must have authenticated access to the lower-privileged account.",
            "evidenceRefs": [
              "ev-1"
            ],
            "id": "authenticated-low-privileged-user",
            "kind": "authentication"
          }
        ],
        "protocols": [
          {
            "id": "http",
            "layer": "application"
          },
          {
            "id": "tcp",
            "layer": "transport"
          }
        ],
        "requiredPathCapabilities": [
          "remote-initiated-ingress"
        ],
        "taxonomyMappings": [],
        "trigger": {
          "artifact": "request",
          "details": "Low-privileged account submits HTTP request during active user-switching session to resolve as operator and switch into administrator account.",
          "directionAtBoundary": "remote-to-vulnerable",
          "phase": "inbound-request-processing"
        },
        "vulnerableRole": "listener"
      }
    ],
    "cveId": "CVE-2026-15240",
    "evidence": [
      {
        "claim": "Customer Switching WordPress plugin before 2.1.3 does not securely bind user-switching session to initiating operator, allowing low-privileged account takeover of administrator.",
        "evidenceId": "ev-1",
        "locator": "containers.cna.descriptions[0].value",
        "pathRefs": [
          "path-1"
        ],
        "sourceId": "cve-list-v5",
        "sourceType": "cve-record",
        "strength": "explicit"
      }
    ],
    "schemaVersion": "attack-path-profile/v1"
  },
  "provenance": {
    "modelVersion": "gemini-3.6-flash",
    "profileFingerprint": "25101ba178d07c196a06d6eceac1602a6e509ddf2d6d2a27510585784cb6d537",
    "sourceFingerprint": "fb775e4488c46662267f9fdd7706e6fe4f9b3cf79e20679f8bd782f6eb992cc5",
    "validatedAt": "2026-08-12T23:46:54Z"
  },
  "publication": {
    "artifactFingerprint": "8546a4efbfa6782093974c2e96df352d71ad12df3fe566a392ae717b0b3087be",
    "publishedAt": "2026-08-13T00:13:37Z",
    "runId": "5064099d-db1d-4e0a-a01c-fb48da74f05a",
    "status": "published"
  },
  "reviewReasons": [],
  "reviewRecommended": false,
  "schemaVersion": "published-attack-path-profile/v2"
}
