{
  "cvss": [
    {
      "baseScore": 9.8,
      "baseSeverity": "CRITICAL",
      "metric": "cvssV3_1",
      "source": "cna",
      "vector": "CVSS:3.1/AV:N/AC:L/PR:N/UI:N/S:U/C:H/I:H/A:H",
      "version": "3.1"
    },
    {
      "baseScore": 9.3,
      "baseSeverity": "CRITICAL",
      "metric": "cvssV4_0",
      "source": "cna",
      "vector": "CVSS:4.0/AV:N/AC:L/AT:N/PR:N/UI:N/VC:H/VI:H/VA:H/SC:N/SI:N/SA:N",
      "version": "4.0"
    }
  ],
  "profile": {
    "attackPaths": [
      {
        "affectedScope": {
          "description": "Fujitsu Software Linux openFT versions prior to 12.1D00",
          "vendor": "Fujitsu",
          "versions": [
            {
              "lessThanOrEqual": "12.1C96",
              "status": "affected",
              "version": "0",
              "versionType": "custom"
            },
            {
              "status": "unaffected",
              "version": "12.1D00",
              "versionType": "custom"
            }
          ]
        },
        "attackerRequirements": [
          {
            "kind": "endpoint-control",
            "value": "remote-client"
          },
          {
            "kind": "input-control",
            "value": "untrusted-input"
          }
        ],
        "confidence": "medium",
        "evidenceRefs": [
          "ev-cve-linux",
          "ev-capec"
        ],
        "interactionInitiator": "attacker-controlled-component",
        "pathId": "path-linux-openft",
        "preconditions": [
          {
            "description": "No authentication is required to send requests to the vulnerable openFT endpoint.",
            "evidenceRefs": [
              "ev-cve-linux"
            ],
            "id": "p-unauth-linux",
            "kind": "authentication"
          }
        ],
        "protocols": [
          {
            "id": "unknown",
            "layer": "application"
          }
        ],
        "requiredPathCapabilities": [
          "remote-initiated-ingress"
        ],
        "taxonomyMappings": [
          {
            "confidence": "medium",
            "evidenceRefs": [
              "ev-capec"
            ],
            "relationship": "related-to",
            "taxonomyId": "CAPEC-100",
            "taxonomyName": "CAPEC",
            "taxonomyVersion": "3.9"
          }
        ],
        "trigger": {
          "artifact": "request",
          "details": "Unauthenticated network request processed by Linux openFT service.",
          "directionAtBoundary": "remote-to-vulnerable",
          "phase": "inbound-request-processing"
        },
        "vulnerableRole": "listener"
      },
      {
        "affectedScope": {
          "description": "Fujitsu Software Oracle Solaris openFT versions prior to 12.1D00",
          "vendor": "Fujitsu",
          "versions": [
            {
              "lessThanOrEqual": "12.1C95",
              "status": "affected",
              "version": "0",
              "versionType": "custom"
            },
            {
              "status": "unaffected",
              "version": "12.1D00",
              "versionType": "custom"
            }
          ]
        },
        "attackerRequirements": [
          {
            "kind": "endpoint-control",
            "value": "remote-client"
          },
          {
            "kind": "input-control",
            "value": "untrusted-input"
          }
        ],
        "confidence": "medium",
        "evidenceRefs": [
          "ev-cve-solaris",
          "ev-capec"
        ],
        "interactionInitiator": "attacker-controlled-component",
        "pathId": "path-solaris-openft",
        "preconditions": [
          {
            "description": "No authentication is required to send requests to the vulnerable openFT endpoint.",
            "evidenceRefs": [
              "ev-cve-solaris"
            ],
            "id": "p-unauth-solaris",
            "kind": "authentication"
          }
        ],
        "protocols": [
          {
            "id": "unknown",
            "layer": "application"
          }
        ],
        "requiredPathCapabilities": [
          "remote-initiated-ingress"
        ],
        "taxonomyMappings": [
          {
            "confidence": "medium",
            "evidenceRefs": [
              "ev-capec"
            ],
            "relationship": "related-to",
            "taxonomyId": "CAPEC-100",
            "taxonomyName": "CAPEC",
            "taxonomyVersion": "3.9"
          }
        ],
        "trigger": {
          "artifact": "request",
          "details": "Unauthenticated network request processed by Oracle Solaris openFT service.",
          "directionAtBoundary": "remote-to-vulnerable",
          "phase": "inbound-request-processing"
        },
        "vulnerableRole": "listener"
      }
    ],
    "cveId": "CVE-2026-16606",
    "evidence": [
      {
        "claim": "Fujitsu Software Linux openFT version 12.1C96 and earlier is vulnerable to unauthenticated remote code execution.",
        "evidenceId": "ev-cve-linux",
        "locator": "containers.cna.affected[0]",
        "pathRefs": [
          "path-linux-openft"
        ],
        "sourceId": "cve-list-v5",
        "sourceType": "cve-record",
        "strength": "explicit"
      },
      {
        "claim": "Fujitsu Software Oracle Solaris openFT version 12.1C95 and earlier is vulnerable to unauthenticated remote code execution.",
        "evidenceId": "ev-cve-solaris",
        "locator": "containers.cna.affected[1]",
        "pathRefs": [
          "path-solaris-openft"
        ],
        "sourceId": "cve-list-v5",
        "sourceType": "cve-record",
        "strength": "explicit"
      },
      {
        "claim": "The CNA maps the vulnerability impact to CAPEC-100 Overflow Buffers.",
        "evidenceId": "ev-capec",
        "locator": "containers.cna.impacts[0]",
        "pathRefs": [
          "path-linux-openft",
          "path-solaris-openft"
        ],
        "sourceId": "cve-list-v5",
        "sourceType": "cve-record",
        "strength": "explicit"
      }
    ],
    "schemaVersion": "attack-path-profile/v1"
  },
  "provenance": {
    "modelVersion": "gemini-3.6-flash",
    "profileFingerprint": "d8971339c3538f536cf6798451036306609d94a8e2fd26bb596c1cc92105fbea",
    "sourceFingerprint": "de1eec99444a99c20f03aa745e07233ef191d523685b84debc6eabb2f5d5f8e7",
    "validatedAt": "2026-08-12T23:46:58Z"
  },
  "publication": {
    "artifactFingerprint": "b3ce679cf5be39e92b4f43b92d33d2f746703dbf125189a02ec9d9d1ecd25af5",
    "publishedAt": "2026-08-13T00:15:20Z",
    "runId": "5064099d-db1d-4e0a-a01c-fb48da74f05a",
    "status": "published"
  },
  "reviewReasons": [
    "path-linux-openft: unknown material field(s): protocols",
    "path-solaris-openft: unknown material field(s): protocols"
  ],
  "reviewRecommended": true,
  "schemaVersion": "published-attack-path-profile/v2"
}
