{
  "cvss": [
    {
      "baseScore": 4.3,
      "baseSeverity": "MEDIUM",
      "metric": "cvssV3_1",
      "source": "adp",
      "sourceIndex": 0,
      "vector": "CVSS:3.1/AV:N/AC:L/PR:N/UI:R/S:U/C:L/I:N/A:N",
      "version": "3.1"
    }
  ],
  "profile": {
    "attackPaths": [
      {
        "affectedScope": {
          "description": "Google Chrome WebAudio component prior to version 147.0.7727.55",
          "vendor": "Google",
          "versions": [
            {
              "lessThan": "147.0.7727.55",
              "status": "affected",
              "version": "0",
              "versionType": "custom"
            }
          ]
        },
        "attackerRequirements": [
          {
            "kind": "endpoint-control",
            "value": "remote-endpoint"
          },
          {
            "kind": "input-control",
            "value": "untrusted-input"
          }
        ],
        "confidence": "high",
        "evidenceRefs": [
          "ev-cve-description"
        ],
        "interactionInitiator": "vulnerable-component",
        "pathId": "path-1",
        "preconditions": [
          {
            "description": "The user must navigate to or load an attacker-controlled web page containing crafted HTML and WebAudio content.",
            "evidenceRefs": [
              "ev-cve-description"
            ],
            "id": "prec-user-interaction",
            "kind": "user-action"
          }
        ],
        "protocols": [
          {
            "id": "http",
            "layer": "application"
          },
          {
            "id": "tls",
            "layer": "security"
          },
          {
            "id": "tcp",
            "layer": "transport"
          }
        ],
        "requiredPathCapabilities": [
          "vulnerable-component-initiated-egress"
        ],
        "taxonomyMappings": [],
        "trigger": {
          "artifact": "response",
          "details": "Chrome processes a crafted HTML page containing malicious WebAudio content.",
          "directionAtBoundary": "remote-to-vulnerable",
          "phase": "remote-response-processing"
        },
        "vulnerableRole": "client"
      }
    ],
    "cveId": "CVE-2026-5864",
    "evidence": [
      {
        "claim": "Heap buffer overflow in WebAudio in Google Chrome prior to 147.0.7727.55 allowed a remote attacker to obtain potentially sensitive information from process memory via a crafted HTML page.",
        "evidenceId": "ev-cve-description",
        "locator": "containers.cna.descriptions[0].value",
        "pathRefs": [
          "path-1"
        ],
        "sourceId": "cve-list-v5",
        "sourceType": "cve-record",
        "strength": "explicit"
      }
    ],
    "schemaVersion": "attack-path-profile/v1"
  },
  "provenance": {
    "modelVersion": "gemini-3.6-flash",
    "profileFingerprint": "0ac0bac9fb21a7a68d0d9a4525c7c79ba1ea83585637c5c976cd0861b53dbd70",
    "sourceFingerprint": "496931d6b0583fd2b30e7b475515b6f27988fd12af3678a8f9aede3f3d4545b3",
    "validatedAt": "2026-08-11T21:28:56Z"
  },
  "publication": {
    "artifactFingerprint": "a83705f75529df50a312ec35adb7e4336f078948f44e41a1e65660f2535e26b4",
    "publishedAt": "2026-08-11T21:54:10Z",
    "runId": "d257f22d-44c3-43d7-a492-d86cfe452af7",
    "status": "published"
  },
  "reviewReasons": [],
  "reviewRecommended": false,
  "schemaVersion": "published-attack-path-profile/v2"
}
