{
  "cvss": [
    {
      "baseScore": 6.8,
      "baseSeverity": "MEDIUM",
      "metric": "cvssV3_1",
      "source": "cna",
      "vector": "CVSS:3.1/AV:A/AC:L/PR:H/UI:N/S:U/C:H/I:H/A:H",
      "version": "3.1"
    }
  ],
  "profile": {
    "attackPaths": [
      {
        "affectedScope": {
          "description": "Splunk Enterprise Search Head Cluster deployment logging Duo 2FA secrets to the _internal index",
          "vendor": "Splunk",
          "versions": [
            {
              "lessThan": "10.0.2",
              "status": "affected",
              "version": "10.0",
              "versionType": "custom"
            },
            {
              "lessThan": "9.4.7",
              "status": "affected",
              "version": "9.4",
              "versionType": "custom"
            },
            {
              "lessThan": "9.3.9",
              "status": "affected",
              "version": "9.3",
              "versionType": "custom"
            },
            {
              "lessThan": "9.2.11",
              "status": "affected",
              "version": "9.2",
              "versionType": "custom"
            }
          ]
        },
        "attackerAccess": {
          "authentication": {
            "requirement": "specific-role",
            "role": "Role with access to Splunk _internal index"
          },
          "authorization": [
            {
              "scheme": "splunk-index-access",
              "value": "_internal"
            }
          ],
          "evidenceRefs": [
            "ev-1"
          ],
          "executionPrivileges": [],
          "resourcePermissions": []
        },
        "attackerRequirements": [
          {
            "endpointRole": "remote-client",
            "evidenceRefs": [
              "ev-1"
            ],
            "id": "req-1",
            "kind": "endpoint-control"
          }
        ],
        "confidence": "high",
        "directOutcomes": [
          {
            "confidence": "high",
            "description": "Authenticated user can view Duo 2FA integrationKey, secretKey, and appSecretKey secrets in plain text.",
            "evidenceRefs": [
              "ev-1"
            ],
            "locus": "vulnerable-component",
            "outcomeId": "out-1",
            "primitive": "information-disclosure",
            "privilegeObtained": "none"
          }
        ],
        "evidenceRefs": [
          "ev-1"
        ],
        "interactionInitiator": "attacker-controlled-component",
        "mitigationAssessment": {
          "options": [],
          "status": "none-supported-by-collected-evidence"
        },
        "pathId": "path-1",
        "preconditions": [
          {
            "description": "The target deployment is a Splunk Search Head Cluster (SHC) using Duo Two-Factor Authentication for Splunk Enterprise.",
            "evidenceRefs": [
              "ev-1"
            ],
            "id": "cond-1",
            "kind": "configuration",
            "resolution": "narrative-only"
          }
        ],
        "protocols": [
          {
            "id": "http",
            "layer": "application"
          },
          {
            "id": "tcp",
            "layer": "transport"
          }
        ],
        "requiredPathCapabilities": [
          "remote-initiated-ingress"
        ],
        "trigger": {
          "artifact": "request",
          "details": "Submitting a search query against the _internal index retrieves plain text Duo 2FA secrets recorded in log output.",
          "directionAtBoundary": "remote-to-vulnerable",
          "phase": "inbound-request-processing"
        },
        "vulnerableRole": "listener"
      }
    ],
    "cveId": "CVE-2026-20138",
    "evidence": [
      {
        "claim": "In affected Splunk Enterprise Search Head Cluster deployments, users with roles granting access to the _internal index can view Duo 2FA integrationKey, secretKey, and appSecretKey secrets in plain text.",
        "evidenceId": "ev-1",
        "locator": "containers.cna.descriptions[0].value",
        "pathRefs": [
          "path-1"
        ],
        "sourceId": "cve-list-v5",
        "sourceType": "cve-record",
        "strength": "explicit"
      }
    ],
    "schemaVersion": "attack-path-profile/v2"
  },
  "reviewReasons": [],
  "reviewRecommended": false,
  "schemaVersion": "published-attack-path-profile/v2"
}
