{
  "cvss": [
    {
      "baseScore": 8.8,
      "baseSeverity": "HIGH",
      "metric": "cvssV3_0",
      "source": "cna",
      "vector": "CVSS:3.0/AV:N/AC:L/PR:L/UI:N/S:U/C:H/I:H/A:H/E:P/RL:X/RC:R",
      "version": "3.0"
    },
    {
      "baseScore": 8.8,
      "baseSeverity": "HIGH",
      "metric": "cvssV3_1",
      "source": "cna",
      "vector": "CVSS:3.1/AV:N/AC:L/PR:L/UI:N/S:U/C:H/I:H/A:H/E:P/RL:X/RC:R",
      "version": "3.1"
    },
    {
      "baseScore": 8.7,
      "baseSeverity": "HIGH",
      "metric": "cvssV4_0",
      "source": "cna",
      "vector": "CVSS:4.0/AV:N/AC:L/AT:N/PR:L/UI:N/VC:H/VI:H/VA:H/SC:N/SI:N/SA:N/E:P",
      "version": "4.0"
    }
  ],
  "profile": {
    "attackPaths": [
      {
        "affectedScope": {
          "description": "UTT \u8fdb\u53d6 520W web management service endpoint /goform/ConfigWirelessBase",
          "vendor": "UTT",
          "versions": [
            {
              "status": "affected",
              "version": "1.7.7-180627"
            }
          ]
        },
        "attackerAccess": {
          "authentication": {
            "requirement": "valid-account"
          },
          "authorization": [],
          "evidenceRefs": [
            "ev-1"
          ],
          "executionPrivileges": [],
          "resourcePermissions": []
        },
        "attackerRequirements": [
          {
            "endpointRole": "remote-client",
            "evidenceRefs": [
              "ev-1"
            ],
            "id": "req-1",
            "kind": "endpoint-control"
          },
          {
            "evidenceRefs": [
              "ev-1"
            ],
            "id": "req-2",
            "kind": "input-control",
            "requirementValue": "untrusted-input"
          }
        ],
        "confidence": "medium",
        "directOutcomes": [
          {
            "confidence": "high",
            "description": "Unbounded strcpy leads to process memory corruption via stack buffer overflow.",
            "evidenceRefs": [
              "ev-1"
            ],
            "locus": "vulnerable-component",
            "outcomeId": "out-1",
            "primitive": "memory-corruption",
            "privilegeObtained": "same-as-locus"
          },
          {
            "confidence": "medium",
            "description": "Exploiting the stack overflow may enable arbitrary code execution within the web service context.",
            "evidenceRefs": [
              "ev-1"
            ],
            "locus": "vulnerable-component",
            "outcomeId": "out-2",
            "primitive": "code-execution",
            "privilegeObtained": "full-control-of-locus"
          }
        ],
        "evidenceRefs": [
          "ev-1"
        ],
        "interactionInitiator": "attacker-controlled-component",
        "mitigationAssessment": {
          "options": [],
          "status": "none-supported-by-collected-evidence"
        },
        "pathId": "path-1",
        "preconditions": [
          {
            "description": "The web management service handling /goform/ConfigWirelessBase is enabled and accessible over the network.",
            "evidenceRefs": [
              "ev-1"
            ],
            "id": "prec-1",
            "kind": "runtime-feature",
            "resolution": "narrative-only"
          }
        ],
        "protocols": [
          {
            "id": "http",
            "layer": "application"
          }
        ],
        "requiredPathCapabilities": [
          "remote-initiated-ingress"
        ],
        "taxonomyMappings": [
          {
            "confidence": "medium",
            "evidenceRefs": [
              "ev-1"
            ],
            "relationship": "related-to",
            "taxonomyId": "CAPEC-8",
            "taxonomyName": "CAPEC",
            "taxonomyVersion": "3.9"
          },
          {
            "confidence": "medium",
            "evidenceRefs": [
              "ev-1"
            ],
            "relationship": "related-to",
            "taxonomyId": "CAPEC-9",
            "taxonomyName": "CAPEC",
            "taxonomyVersion": "3.9"
          },
          {
            "confidence": "medium",
            "evidenceRefs": [
              "ev-1"
            ],
            "relationship": "related-to",
            "taxonomyId": "CAPEC-10",
            "taxonomyName": "CAPEC",
            "taxonomyVersion": "3.9"
          },
          {
            "confidence": "medium",
            "evidenceRefs": [
              "ev-1"
            ],
            "relationship": "related-to",
            "taxonomyId": "CAPEC-14",
            "taxonomyName": "CAPEC",
            "taxonomyVersion": "3.9"
          },
          {
            "confidence": "medium",
            "evidenceRefs": [
              "ev-1"
            ],
            "relationship": "related-to",
            "taxonomyId": "CAPEC-24",
            "taxonomyName": "CAPEC",
            "taxonomyVersion": "3.9"
          },
          {
            "confidence": "medium",
            "evidenceRefs": [
              "ev-1"
            ],
            "relationship": "related-to",
            "taxonomyId": "CAPEC-42",
            "taxonomyName": "CAPEC",
            "taxonomyVersion": "3.9"
          },
          {
            "confidence": "medium",
            "evidenceRefs": [
              "ev-1"
            ],
            "relationship": "related-to",
            "taxonomyId": "CAPEC-44",
            "taxonomyName": "CAPEC",
            "taxonomyVersion": "3.9"
          },
          {
            "confidence": "medium",
            "evidenceRefs": [
              "ev-1"
            ],
            "relationship": "related-to",
            "taxonomyId": "CAPEC-45",
            "taxonomyName": "CAPEC",
            "taxonomyVersion": "3.9"
          },
          {
            "confidence": "medium",
            "evidenceRefs": [
              "ev-1"
            ],
            "relationship": "related-to",
            "taxonomyId": "CAPEC-46",
            "taxonomyName": "CAPEC",
            "taxonomyVersion": "3.9"
          },
          {
            "confidence": "medium",
            "evidenceRefs": [
              "ev-1"
            ],
            "relationship": "related-to",
            "taxonomyId": "CAPEC-47",
            "taxonomyName": "CAPEC",
            "taxonomyVersion": "3.9"
          },
          {
            "confidence": "medium",
            "evidenceRefs": [
              "ev-1"
            ],
            "relationship": "related-to",
            "taxonomyId": "CAPEC-67",
            "taxonomyName": "CAPEC",
            "taxonomyVersion": "3.9"
          },
          {
            "confidence": "medium",
            "evidenceRefs": [
              "ev-1"
            ],
            "relationship": "related-to",
            "taxonomyId": "CAPEC-92",
            "taxonomyName": "CAPEC",
            "taxonomyVersion": "3.9"
          },
          {
            "confidence": "medium",
            "evidenceRefs": [
              "ev-1"
            ],
            "relationship": "related-to",
            "taxonomyId": "CAPEC-100",
            "taxonomyName": "CAPEC",
            "taxonomyVersion": "3.9"
          },
          {
            "confidence": "medium",
            "evidenceRefs": [
              "ev-1"
            ],
            "relationship": "related-to",
            "taxonomyId": "CAPEC-123",
            "taxonomyName": "CAPEC",
            "taxonomyVersion": "3.9"
          }
        ],
        "trigger": {
          "artifact": "request",
          "details": "An HTTP request sent to /goform/ConfigWirelessBase passes a crafted ssid argument to strcpy, triggering a stack buffer overflow.",
          "directionAtBoundary": "remote-to-vulnerable",
          "phase": "inbound-request-processing"
        },
        "vulnerableRole": "listener"
      }
    ],
    "cveId": "CVE-2026-0838",
    "evidence": [
      {
        "claim": "UTT \u8fdb\u53d6 520W 1.7.7-180627 contains a strcpy buffer overflow in /goform/ConfigWirelessBase when processing the ssid argument remotely.",
        "evidenceId": "ev-1",
        "locator": "containers.cna.descriptions[0].value",
        "pathRefs": [
          "path-1"
        ],
        "sourceId": "cve-list-v5",
        "sourceType": "cve-record",
        "strength": "explicit"
      }
    ],
    "schemaVersion": "attack-path-profile/v2"
  },
  "reviewReasons": [
    "path-1: narrative-only condition(s) require analyst resolution: prec-1",
    "path-1: no authoritative mitigation source was collected"
  ],
  "reviewRecommended": true,
  "schemaVersion": "published-attack-path-profile/v2"
}
