{
  "cvss": [
    {
      "baseScore": 6.1,
      "baseSeverity": "MEDIUM",
      "metric": "cvssV3_1",
      "source": "adp",
      "sourceIndex": 0,
      "vector": "CVSS:3.1/AV:N/AC:L/PR:N/UI:R/S:C/C:L/I:L/A:N",
      "version": "3.1"
    }
  ],
  "profile": {
    "attackPaths": [
      {
        "affectedScope": {
          "description": "Sina Extension for Elementor WordPress plugin before version 3.10.2",
          "vendor": "Unknown",
          "versions": [
            {
              "lessThan": "3.10.2",
              "status": "affected",
              "version": "0",
              "versionType": "semver"
            }
          ]
        },
        "attackerRequirements": [
          {
            "kind": "input-control",
            "value": "untrusted-input"
          }
        ],
        "confidence": "high",
        "evidenceRefs": [
          "ev-1"
        ],
        "interactionInitiator": "remote-component",
        "pathId": "path-1",
        "preconditions": [
          {
            "description": "A victim user must trigger the crafted HTTP request (such as by clicking a link).",
            "evidenceRefs": [
              "ev-1"
            ],
            "id": "cond-1",
            "kind": "user-action"
          }
        ],
        "protocols": [
          {
            "id": "http",
            "layer": "application"
          }
        ],
        "requiredPathCapabilities": [
          "remote-initiated-ingress"
        ],
        "taxonomyMappings": [],
        "trigger": {
          "artifact": "request",
          "details": "An unauthenticated HTTP AJAX request containing reconstructed input is processed without sanitization and reflected in the response.",
          "directionAtBoundary": "remote-to-vulnerable",
          "phase": "inbound-request-processing"
        },
        "vulnerableRole": "listener"
      }
    ],
    "cveId": "CVE-2026-14190",
    "evidence": [
      {
        "claim": "The Sina Extension for Elementor WordPress plugin before 3.10.2 does not escape input reconstructed in an unauthenticated AJAX handler before reflecting it in the HTTP response.",
        "evidenceId": "ev-1",
        "locator": "containers.cna.descriptions[0].value",
        "pathRefs": [
          "path-1"
        ],
        "sourceId": "cve-list-v5",
        "sourceType": "cve-record",
        "strength": "explicit"
      }
    ],
    "schemaVersion": "attack-path-profile/v1"
  },
  "provenance": {
    "modelVersion": "gemini-3.6-flash",
    "profileFingerprint": "89413a99a0c9e33c6a8c411e55c75d7e0b58e2b2e11c083698214ca0a4da3c74",
    "sourceFingerprint": "a4983d4d98f0ca47d644997fb394326941cc2432865c028323a41668ba22c4b6",
    "validatedAt": "2026-08-12T23:46:59Z"
  },
  "publication": {
    "artifactFingerprint": "19b3f0535d46cd5b8119179c291536c0aae5076bf74b65fa1722307b4b28aa0a",
    "publishedAt": "2026-08-13T00:14:23Z",
    "runId": "ed9929f1-c3a8-4368-8c21-82808c2b697b",
    "status": "published"
  },
  "reviewReasons": [],
  "reviewRecommended": false,
  "schemaVersion": "published-attack-path-profile/v2"
}
