{
  "cvss": [
    {
      "baseScore": 8.4,
      "baseSeverity": "HIGH",
      "metric": "cvssV3_1",
      "source": "cna",
      "vector": "CVSS:3.1/AV:N/AC:H/PR:L/UI:N/S:C/C:H/I:H/A:L",
      "version": "3.1"
    }
  ],
  "profile": {
    "attackPaths": [
      {
        "affectedScope": {
          "description": "GitLab CE/EE pipeline schedule component",
          "vendor": "GitLab",
          "versions": [
            {
              "lessThan": "19.0.5",
              "status": "affected",
              "version": "18.0",
              "versionType": "semver"
            },
            {
              "lessThan": "19.1.3",
              "status": "affected",
              "version": "19.1",
              "versionType": "semver"
            },
            {
              "lessThan": "19.2.1",
              "status": "affected",
              "version": "19.2",
              "versionType": "semver"
            }
          ]
        },
        "attackerRequirements": [
          {
            "kind": "endpoint-control",
            "value": "remote-client"
          },
          {
            "kind": "input-control",
            "value": "untrusted-input"
          }
        ],
        "confidence": "high",
        "evidenceRefs": [
          "ev-cve-desc",
          "ev-cve-versions"
        ],
        "interactionInitiator": "attacker-controlled-component",
        "pathId": "path-1",
        "preconditions": [
          {
            "description": "The attacker must be an authenticated GitLab user.",
            "evidenceRefs": [
              "ev-cve-desc"
            ],
            "id": "precond-auth",
            "kind": "authentication"
          },
          {
            "description": "Pipeline schedule creation or modification functionality is accessible.",
            "evidenceRefs": [
              "ev-cve-desc"
            ],
            "id": "precond-pipeline-schedules",
            "kind": "runtime-feature"
          }
        ],
        "protocols": [
          {
            "id": "http",
            "layer": "application"
          }
        ],
        "requiredPathCapabilities": [
          "remote-initiated-ingress"
        ],
        "taxonomyMappings": [],
        "trigger": {
          "artifact": "request",
          "details": "Processing pipeline schedule inputs with improperly validated attributes allows modifying CI/CD configurations.",
          "directionAtBoundary": "remote-to-vulnerable",
          "phase": "inbound-request-processing"
        },
        "vulnerableRole": "listener"
      }
    ],
    "cveId": "CVE-2026-12436",
    "evidence": [
      {
        "claim": "GitLab CE/EE improperly validates user-supplied attributes when processing pipeline schedule inputs, allowing an authenticated user to modify CI/CD configuration belonging to another user.",
        "evidenceId": "ev-cve-desc",
        "locator": "containers.cna.descriptions[0].value",
        "pathRefs": [
          "path-1"
        ],
        "sourceId": "cve-list-v5",
        "sourceType": "cve-record",
        "strength": "explicit"
      },
      {
        "claim": "Affected versions are GitLab CE/EE from 18.0 before 19.0.5, 19.1 before 19.1.3, and 19.2 before 19.2.1.",
        "evidenceId": "ev-cve-versions",
        "locator": "containers.cna.affected[0].versions",
        "pathRefs": [
          "path-1"
        ],
        "sourceId": "cve-list-v5",
        "sourceType": "cve-record",
        "strength": "explicit"
      }
    ],
    "schemaVersion": "attack-path-profile/v1"
  },
  "provenance": {
    "modelVersion": "gemini-3.6-flash",
    "profileFingerprint": "7b39f60148403856c01036084b4d0c97043fb308abd86e472dc6ad86d3e19a2d",
    "sourceFingerprint": "b990e6ac454b334820951d06dfdad884413abdfc6d71ac748047dd9d947f837a",
    "validatedAt": "2026-08-13T01:00:11Z"
  },
  "publication": {
    "artifactFingerprint": "dcbb94ceed149ff6007d9a2ac3c164b93b60b8b362188243623ea2be53bcd25e",
    "publishedAt": "2026-08-13T01:24:32Z",
    "runId": "fe70585b-59f7-419c-a236-74e95feceff7",
    "status": "published"
  },
  "reviewReasons": [],
  "reviewRecommended": false,
  "schemaVersion": "published-attack-path-profile/v2"
}
