{
  "cvss": [
    {
      "baseScore": 6.5,
      "baseSeverity": "MEDIUM",
      "metric": "cvssV3_1",
      "source": "adp",
      "sourceIndex": 0,
      "vector": "CVSS:3.1/AV:N/AC:L/PR:N/UI:R/S:U/C:H/I:N/A:N",
      "version": "3.1"
    }
  ],
  "profile": {
    "attackPaths": [
      {
        "affectedScope": {
          "description": "Google Chrome on Mac prior to 148.0.7778.216",
          "vendor": "Google",
          "versions": [
            {
              "lessThan": "148.0.7778.216",
              "status": "affected",
              "version": "0",
              "versionType": "custom"
            }
          ]
        },
        "attackerRequirements": [
          {
            "kind": "endpoint-control",
            "value": "remote-endpoint"
          },
          {
            "kind": "input-control",
            "value": "untrusted-input"
          }
        ],
        "confidence": "high",
        "evidenceRefs": [
          "ev-1"
        ],
        "interactionInitiator": "vulnerable-component",
        "pathId": "path-1",
        "preconditions": [
          {
            "description": "User navigates to or opens an attacker-controlled crafted HTML page in Google Chrome on Mac.",
            "evidenceRefs": [
              "ev-1"
            ],
            "id": "prec-1",
            "kind": "user-action"
          },
          {
            "description": "WebRTC functionality is rendered or invoked by the loaded page.",
            "evidenceRefs": [
              "ev-1"
            ],
            "id": "prec-2",
            "kind": "runtime-feature"
          }
        ],
        "protocols": [
          {
            "id": "http",
            "layer": "application"
          }
        ],
        "requiredPathCapabilities": [
          "vulnerable-component-initiated-egress"
        ],
        "taxonomyMappings": [],
        "trigger": {
          "artifact": "response",
          "details": "Processing a crafted HTML page with WebRTC content triggers an out-of-bounds read in WebRTC.",
          "directionAtBoundary": "remote-to-vulnerable",
          "phase": "remote-response-processing"
        },
        "vulnerableRole": "client"
      }
    ],
    "cveId": "CVE-2026-9996",
    "evidence": [
      {
        "claim": "Out of bounds read in WebRTC in Google Chrome on Mac prior to 148.0.7778.216 allowed a remote attacker to obtain potentially sensitive information from process memory via a crafted HTML page.",
        "evidenceId": "ev-1",
        "locator": "containers.cna.descriptions[0].value",
        "pathRefs": [
          "path-1"
        ],
        "sourceId": "cve-list-v5",
        "sourceType": "cve-record",
        "strength": "explicit"
      }
    ],
    "schemaVersion": "attack-path-profile/v1"
  },
  "provenance": {
    "modelVersion": "gemini-3.6-flash",
    "profileFingerprint": "f8597653bbaa69bdf350d820a42a8cf8210735313b1cbed030a792879a798289",
    "sourceFingerprint": "da532ff62b3e1e8a9a14547fc7058a118436a748353322c652cdd793494c9139",
    "validatedAt": "2026-08-12T23:58:44Z"
  },
  "publication": {
    "artifactFingerprint": "7392926d4426c087cf7b5c892b18cbb0a3c226be7a40ffa8d785312815a6c576",
    "publishedAt": "2026-08-13T00:15:42Z",
    "runId": "9499e938-5fe7-4f2e-87f7-6ee32de45c21",
    "status": "published"
  },
  "reviewReasons": [],
  "reviewRecommended": false,
  "schemaVersion": "published-attack-path-profile/v2"
}
