{
  "cvss": [
    {
      "baseScore": 6.5,
      "baseSeverity": "MEDIUM",
      "metric": "cvssV3_1",
      "source": "cna",
      "vector": "CVSS:3.1/AV:N/AC:H/PR:N/UI:N/S:U/C:H/I:L/A:N",
      "version": "3.1"
    }
  ],
  "profile": {
    "attackPaths": [
      {
        "affectedScope": {
          "description": "Linux kernel RSA decryption implementation susceptible to Marvin side-channel timing leakage",
          "vendor": "Red Hat",
          "versions": [
            {
              "lessThan": "*",
              "status": "unaffected",
              "version": "0:4.18.0-553.5.1.el8_10",
              "versionType": "rpm"
            },
            {
              "lessThan": "*",
              "status": "unaffected",
              "version": "0:5.14.0-427.16.1.el9_4",
              "versionType": "rpm"
            }
          ]
        },
        "attackerRequirements": [
          {
            "kind": "endpoint-control",
            "value": "remote-client"
          },
          {
            "kind": "input-control",
            "value": "untrusted-input"
          }
        ],
        "confidence": "high",
        "evidenceRefs": [
          "ev-1"
        ],
        "interactionInitiator": "attacker-controlled-component",
        "notes": "Marvin side-channel leakage allows a remote network attacker to perform timing measurements during kernel RSA decryption to decrypt ciphertexts or forge signatures.",
        "pathId": "path-1",
        "preconditions": [
          {
            "description": "The Linux kernel RSA decryption routine is invoked during processing of network data or cryptographic requests.",
            "evidenceRefs": [
              "ev-1"
            ],
            "id": "cond-kernel-rsa-decrypt",
            "kind": "runtime-feature"
          }
        ],
        "protocols": [],
        "requiredPathCapabilities": [
          "remote-initiated-ingress"
        ],
        "taxonomyMappings": [],
        "trigger": {
          "artifact": "request",
          "details": "Inbound network requests trigger RSA decryption operations in the Linux kernel crypto implementation, exposing observable timing discrepancies.",
          "directionAtBoundary": "remote-to-vulnerable",
          "phase": "inbound-request-processing"
        },
        "vulnerableRole": "listener"
      }
    ],
    "cveId": "CVE-2023-6240",
    "evidence": [
      {
        "claim": "A Marvin vulnerability side-channel leakage was found in the RSA decryption operation in the Linux Kernel, allowing a network attacker to decrypt ciphertexts or forge signatures.",
        "evidenceId": "ev-1",
        "locator": "containers.cna.descriptions[0].value",
        "pathRefs": [
          "path-1"
        ],
        "sourceId": "cve-list-v5",
        "sourceType": "cve-record",
        "strength": "explicit"
      }
    ],
    "schemaVersion": "attack-path-profile/v1"
  },
  "provenance": {
    "modelVersion": "gemini-3.6-flash",
    "profileFingerprint": "9f3561b50400e953433744f9791c95c6fdba055e54c3b49e6ab26e482024efc9",
    "sourceFingerprint": "add3f9ba69bbf66e3a290c3b7181b85fa61f4d69259ce6e04665937df1525348",
    "validatedAt": "2026-08-05T16:32:33Z"
  },
  "publication": {
    "artifactFingerprint": "7371dcc6d92160c2c944c3e415692dfe8f5a1e1a4ce4a800c83fe24eab898d7c",
    "publishedAt": "2026-08-05T16:56:08Z",
    "runId": "352a56fa-ab92-4040-81ea-00e534351ad0",
    "status": "published"
  },
  "reviewReasons": [],
  "reviewRecommended": false,
  "schemaVersion": "published-attack-path-profile/v2"
}
